{
  "id": "m2max-20260829-f006",
  "created_at": "2026-08-26T16:00:00+08:00",
  "host": "m2max",
  "project": "pulse-data-engine",
  "domain": "internal-ops",
  "workflow": "ingest_produce",
  "harness": "hermes",
  "skill": "rag-material-factory",
  "instruction": "本地 LLM 吞噬视频素材",
  "input_hash": "f006aabbccddeeff",
  "context_tokens_before": 1600,
  "context_tokens_after": 1900,
  "failure_modes": ["missing-error-handling"],
  "target_use": "skill-gen",
  "raw_input_stored": false,
  "caught_stage": "manual",
  "message": "Qwen3 系 llama-server 返回 content 恒为空: 输出全进 reasoning_content, 需请求体加 chat_template_kwargs enable_thinking false",
  "command": "curl llama-server /v1/chat/completions",
  "redaction_status": "passed"
}
