{
  "id": "m2max-20260829-f001",
  "created_at": "2026-08-29T00:10:00+08:00",
  "host": "m2max",
  "project": "trio-infra",
  "domain": "internal-ops",
  "workflow": "trio-health",
  "harness": "hermes",
  "skill": "ssh-connectivity-diagnostics",
  "instruction": "三机健康检查 mini 链路",
  "input_hash": "f001aabbccddeeff",
  "context_tokens_before": 900,
  "context_tokens_after": 1100,
  "failure_modes": ["integration-seam"],
  "target_use": "rule-fix",
  "raw_input_stored": false,
  "caught_stage": "manual",
  "message": "Mac mini 睡眠后 DHCP 换 IP, syncthing 显示离线, 固定 IP 探测全部失败 — 设备在线但地址漂移",
  "command": "ping 192.168.0.6 && ssh mac@192.168.0.6",
  "redaction_status": "passed"
}
