{
  "id": "m2max-20260829-f003",
  "created_at": "2026-08-29T00:20:00+08:00",
  "host": "m2max",
  "project": "trio-infra",
  "domain": "internal-ops",
  "workflow": "git-sync",
  "harness": "hermes",
  "skill": "github-pr-workflow",
  "instruction": "拉取远端代码",
  "input_hash": "f003aabbccddeeff",
  "context_tokens_before": 650,
  "context_tokens_after": 800,
  "failure_modes": ["contract-drift"],
  "target_use": "rule-fix",
  "raw_input_stored": false,
  "caught_stage": "manual",
  "message": "git pull --rebase 被 untracked 运行产物挡住: 本机 intel cron 生成的 scene2_intel/livestream 文件与远端已跟踪文件同名冲突",
  "command": "git pull --rebase",
  "redaction_status": "passed"
}
